{
  "id": "qing.canary",
  "name": "Tauri Module Canary",
  "description": "A tiny native process used to verify the Tauri module handshake.",
  "version": "0.1.0",
  "apiVersion": 1,
  "author": "QingMo-A",
  "entry": "bin/qing-module-canary.exe",
  "runtimeType": "Process",
  "runtimeIsolation": "OutOfProcess",
  "uiKind": "Web",
  "webEntry": "ui/index.html",
  "loadMode": "Manual",
  "permissions": [],
  "operations": ["ping"],
  "icon": "icon.svg"
}
