{
  "id": "qing.launcher",
  "name": "Qing Launcher",
  "description": "Rust-powered application launchpad for QingToolbox.",
  "version": "0.3.0",
  "apiVersion": 1,
  "author": "QingMo-A",
  "entry": "bin/qing-launcher-module.exe",
  "runtimeType": "Process",
  "runtimeIsolation": "OutOfProcess",
  "uiKind": "Web",
  "webEntry": "ui/index.html",
  "loadMode": "Manual",
  "permissions": ["FileRead", "FileWrite", "ProcessStart", "WindowControl"],
  "operations": [
    "getState",
    "getItemIcon",
    "refreshDesktop",
    "setSortMode",
    "addDesktopItemToCustom",
    "setCustomOrder",
    "setHotkey",
    "launchItem",
    "removeItem",
    "createFolder",
    "renameFolder",
    "moveItemToFolder",
    "moveItemOutOfFolder",
    "setFolderOrder",
    "deleteFolder",
    "searchEverything",
    "getEverythingStatus",
    "openEverythingResult",
    "openEverythingResultFolder",
    "copyEverythingResultPath"
  ],
  "events": [
    "launcher.externalDrop"
  ],
  "icon": "icon.svg"
}
